,tweet_created_at,country_code,country_name,user_id,user_created_at,user_name,user_source,user_verified,user_favourites_count,user_followers_count,user_friends_count,tweet_is_retweet,tweet
1,2020-11-02 15:34:42,KW,Kuwait,249993359.0,10-Feb-2011 (05:39:47.000000),wamokins,,False,,532,,True,"  Prince William, Duke of Cambridge, tested positive for COVID-19 in April, royal sources tell  News.  ht…"
3,2020-11-02 15:05:37,KW,Kuwait,2962314666.0,07-Jan-2015 (06:05:20.000000),KBRI_Kuwait,,False,,2875,,False,"Updated info on Covid-19 in Kuwait. Please follow official sources for valid info (Kuwait Ministry of Health, Indonesian National Nurse Association in Kuwait/2 Nov 2020  Kuwait time or  Jakarta time). #inidiplomasi #negaramelindungi   "
6,2020-11-02 15:05:37,KW,Kuwait,2962314666.0,07-Jan-2015 (06:05:20.000000),KBRI_Kuwait,,False,,2875,,False,"Updated info on Covid-19 in Kuwait. Please follow official sources for valid info (Kuwait Ministry of Health, Indonesian National Nurse Association in Kuwait/2 Nov 2020  Kuwait time or  Jakarta time). #inidiplomasi #negaramelindungi   "
7,2020-11-02 15:11:56,KW,Kuwait,74745791.0,16-Sep-2009 (14:39:59.000000),aqazi,,False,,48,,True,  Rajasthan bans the sale and bursting of firecrackers in order to protect COVID-19 patients from poisonous smoke caused by…
8,2020-11-02 15:14:06,KW,Kuwait,8.169010842497268e+17,05-Jan-2017 (06:56:10.000000),shirazkuwait,,False,,370,,True,  Please wear a mask for your and others safety. 
13,2020-11-02 16:55:29,KW,Kuwait,242686044.0,25-Jan-2011 (10:43:01.000000),7sain_89,,False,,525,,True,  Your choice to give up the last 7 months of your regular life being careful and socially distancing could very well be…
14,2020-11-02 16:54:27,KW,Kuwait,73377536.0,11-Sep-2009 (12:47:03.000000),rami_riachy,,False,,91,,False,Fast. Powerful. Scalable. Three reasons high-performance computing is well-suited to take on the search for a COVID-19 treatment. Get the details from  #HPC #healthcare  
15,2020-11-02 17:41:11,KW,Kuwait,8.984627641167094e+17,18-Aug-2017 (08:33:10.000000),MauriceNKuwait,,False,,78,,True,  The Great Covid-19 Reset 
16,2020-11-02 17:17:46,KW,Kuwait,223733357.0,07-Dec-2010 (05:25:14.000000),GiiiKh,,False,,422,,False,Why is this so hard for everyone?
17,2020-11-02 18:25:31,KW,Kuwait,2834947514.0,28-Sep-2014 (10:45:24.000000),UNinKuwait,,False,,5641,,True,  A heartfelt thank you to the more than 2.3 million people worldwide who have raised your voice in support of the  a…
20,2020-11-02 17:43:38,KW,Kuwait,477432535.0,29-Jan-2012 (05:42:56.000000),Iamsabbag,,False,,93000,,True,  Hmmm thats scary 😟
21,2020-11-02 19:24:09,KW,Kuwait,1.074399233153876e+18,16-Dec-2018 (20:21:53.000000),itsnmouf,,False,,1,,True,  “None of these vaccines are going to give us complete protection.”  Former prime minister Tony Blair explains that society is…
23,2020-11-02 19:24:09,KW,Kuwait,1.074399233153876e+18,16-Dec-2018 (20:21:53.000000),itsnmouf,,False,,1,,True,  “None of these vaccines are going to give us complete protection.”  Former prime minister Tony Blair explains that society is…
24,2020-11-02 19:21:55,KW,Kuwait,1.074399233153876e+18,16-Dec-2018 (20:21:53.000000),itsnmouf,,False,,1,,True,  Kids are participating in COVID-19 vaccine trials. Here's what their parents think 
26,2020-11-02 18:59:30,KW,Kuwait,170226165.0,24-Jul-2010 (07:21:29.000000),arabtimeskuwait,,False,,17085,,False,No increase in divorce rates during COVID-19 crisis  #Kuwait #Divorce #Coronavirus #COVID19   
27,2020-11-02 19:21:55,KW,Kuwait,1.074399233153876e+18,16-Dec-2018 (20:21:53.000000),itsnmouf,,False,,1,,True,  Kids are participating in COVID-19 vaccine trials. Here's what their parents think 
28,2020-11-02 19:17:03,KW,Kuwait,2259182946.0,23-Dec-2013 (17:17:30.000000),indembkwt,,True,,45450,,False,#NationalAyushProtocol #Ayurveda4Health
29,2020-11-02 19:17:03,KW,Kuwait,2259182946.0,23-Dec-2013 (17:17:30.000000),indembkwt,,True,,45450,,False,#NationalAyushProtocol #Ayurveda4Health
30,2020-11-02 19:33:44,KW,Kuwait,2259182946.0,23-Dec-2013 (17:17:30.000000),indembkwt,,True,,45450,,True,  #NationalAyushProtocol #Ayurveda4Health
31,2020-11-02 18:41:50,KW,Kuwait,528380850.0,18-Mar-2012 (10:29:19.000000),5adejaA,,False,,899,,False,Economical warfare.
32,2020-11-02 19:07:05,KW,Kuwait,3178579663.0,28-Apr-2015 (20:54:20.000000),Eylauph,,False,,136,,False,Ah nawwww
33,2020-11-02 18:35:59,KW,Kuwait,9.587146610499544e+17,31-Jan-2018 (14:52:42.000000),fetaaamy,,False,,265,,False,"If you don’t have a gel eye mask, get one, put it in the freezer for an hour, and wear it after a long day"
34,2020-11-02 19:33:44,KW,Kuwait,2259182946.0,23-Dec-2013 (17:17:30.000000),indembkwt,,True,,45450,,True,  #NationalAyushProtocol #Ayurveda4Health
35,2020-11-02 20:07:51,KW,Kuwait,227966200.0,18-Dec-2010 (09:54:46.000000),hanoofaEm,,False,,295,,False,Lab work videos!  The life of covid19 scientists. 
36,2020-11-02 19:24:00,KW,Kuwait,376189817.0,19-Sep-2011 (13:23:39.000000),Dr_Rowaished,,False,,179,,True,  Fire Trump. Keep Fauci. Wear a mask. End the war on science. VOTE! VOTE! VOTE!
37,2020-11-02 20:09:16,KW,Kuwait,4766912115.0,10-Jan-2016 (19:10:06.000000),iBritsy,,False,,299,,False,- Madison has the baby &amp; then dies from #COVID #covid19  - Kevin gives the baby to Kate - Randall’s Therapist turns out to be his sister from his birth mother ....  - Randall’s birth mum is dead - someone definitely dies from #COVID 😷
40,2020-11-02 23:38:44,KW,Kuwait,9.905870544876708e+17,29-Apr-2018 (13:42:12.000000),__muhammadx,,False,,1265,,True,"  Nigeria just goes with every Western trend, except economic development."
42,2020-11-03 00:28:06,KW,Kuwait,51540579.0,27-Jun-2009 (20:05:17.000000),ziaahmedkhan,,False,,4001,,False,Modi has made India such a global power that it is below Bangladesh and Pakistan in hunger index India Slips Down Global Hunger Index – Even Without Factoring in COVID-19 
43,2020-11-03 04:16:21,KW,Kuwait,8.984627641167092e+17,18-Aug-2017 (08:33:10.000000),MauriceNKuwait,,False,,78,,True,"  The #COVID19 hysteria is based on manipulating the numbers.  # of cases boosted by faulty tests, almost all of them will…"
45,2020-11-03 03:05:20,KW,Kuwait,24238587.0,13-Mar-2009 (19:52:21.000000),TremainRossyion,,False,,742,,False,🙌🏽🙌🏽🙌🏽🙌🏽🙌🏽🇺🇸
47,2020-11-03 03:25:21,KW,Kuwait,266972503.0,16-Mar-2011 (03:37:02.000000),salmaAlHussaini,,False,,11,,True,  Thousands of people in Montenegro attended the funeral of a bishop who died after contracting COVID-19.   The funeral has stoke…
48,2020-11-03 01:59:14,KW,Kuwait,1.2634769001582019e+18,21-May-2020 (14:29:59.000000),expatimes,,False,,48,,False,"No increase in divorce rates during COVID-19 crisis ———  KUWAIT CITY, Nov 2: Director of the Family Counseling Department at the Ministr... #kuwait Full Article:  "
49,2020-11-03 11:45:45,KW,Kuwait,7.855999190170583e+17,10-Oct-2016 (21:56:31.000000),DrMhmdotaibiq8,,False,,107,,False,Britain records FEWEST daily Covid-19 cases in a fortnight  via 
51,2020-11-03 13:46:41,KW,Kuwait,223684648.0,07-Dec-2010 (01:54:52.000000),mbhbox,,False,,1450,,True,    This is a slovak web page. All the results are taken from the SVK Ministry of Health. 
53,2020-11-03 13:46:41,KW,Kuwait,223684648.0,07-Dec-2010 (01:54:52.000000),mbhbox,,False,,1451,,True,    This is a slovak web page. All the results are taken from the SVK Ministry of Health. 
65,2020-11-03 14:06:45,KW,Kuwait,1.185234326482555e+18,18-Oct-2019 (16:41:14.000000),SherlinSolomon,,False,,3027,,True,  . decision to ban the sale of firecrackers is adding misery to the lives of millions of workers in the Firew…
67,2020-11-03 14:06:38,KW,Kuwait,2259182946.0,23-Dec-2013 (17:17:30.000000),indembkwt,,True,,45462,,True,  Discussed COVID19 recovery and agreed to work towards to trade &amp; travel normalcy. The movement of Indian healthcare prof…
68,2020-11-03 13:52:07,KW,Kuwait,138159430.0,28-Apr-2010 (19:57:17.000000),smfaroo,,False,,65,,True,  Covid19 positive person voting today in RR Nagar by poll in Bangalore. Booth was fully sanitized post this. Voter was ferrie…
72,2020-11-03 13:09:59,KW,Kuwait,1.263476900158202e+18,21-May-2020 (14:29:59.000000),expatimes,,False,,48,,False,"787 more infected from coronavirus ———  KUWAIT CITY, Nov 03: Kuwait Ministry of Health reported 3 deaths and 787 cases ... #kuwait Full Article:  "
84,2020-11-03 12:30:26,KW,Kuwait,484214641.0,05-Feb-2012 (21:19:22.000000),latifahjamall,,False,,217,,False,Hegemony as explained by Gramsci.
87,2020-11-03 13:02:11,KW,Kuwait,7.894832345350144e+17,21-Oct-2016 (15:07:25.000000),KFHGroup_Eng,,False,,10856,,False,"Keeping you safe, healthy and happy is our priority during #Covid19. Download our customer handbook explaining precautionary measures by clicking this link:  "
88,2020-11-03 12:04:49,KW,Kuwait,9.656425352920228e+17,19-Feb-2018 (17:41:35.000000),bibigartiga,,False,,2,,True,"  Lockdowns are multiplying throughout Europe as Covid-19 cases rise exponentially, threatening to push health services across the c…"
96,2020-11-03 12:39:19,KW,Kuwait,7.724753134734213e+17,04-Sep-2016 (16:44:01.000000),AymanMatNews,,False,,2863,,False,#Kuwait Central Blood Bank: People who’ve had #Covid19 symptoms urged to donate plasma due to a shortage of donors.. 👇  
100,2020-11-03 11:51:02,KW,Kuwait,98352497.0,21-Dec-2009 (11:15:18.000000),IIKNews,,False,,4334,,False,"787 new infection reported on Tuesday - Kuwait on Tuesday registered 787 new cases of Covid-19 in last 24 hours. The total number of cases increased to 128,080 and the death toll reaches 789 with 3 new fatality.…  #kuwaitnews #indiakuwait #indiansinkuwait "
101,2020-11-03 13:39:18,KW,Kuwait,1.228783131701936e+18,15-Feb-2020 (20:49:03.000000),sittinichi,,False,,109,,True,  JUST IN: The Philippines has been voted Asia’s Leading Dive Destination and Asia’s Leading Beach Destination and won 5…
102,2020-11-03 12:26:50,KW,Kuwait,332572613.0,10-Jul-2011 (02:02:18.000000),genuine_q8ie,,False,,454,,False,  The statement is from CDC. And CDC always spreads fear about coronavirus
104,2020-12-10 21:54:04,KW,Kuwait,184444072.0,29-Aug-2010 (15:35:34.000000),7awooory,,False,,1615,,True,  I've been getting a lot of questions of how the Pfizer's COVID19 vaccine side effect profile compares to other common vac…
107,2020-12-10 22:47:45,KW,Kuwait,63629106.0,07-Aug-2009 (03:47:21.000000),BarjasMAlBarjas,,False,,19297,,True,  BREAKING: FDA panel has recommended the approval of Pfizer coronavirus vaccine
108,2020-12-10 22:03:39,KW,Kuwait,7.928624467677307e+17,30-Oct-2016 (22:55:12.000000),over_dress,,False,,11,,True,"  NEWS:  published safety and final efficacy results from the Phase 3 trial of our #COVID19 vaccine, developed w/ "
109,2020-12-10 22:03:39,KW,Kuwait,7.928624467677307e+17,30-Oct-2016 (22:55:12.000000),over_dress,,False,,11,,True,"  NEWS:  published safety and final efficacy results from the Phase 3 trial of our #COVID19 vaccine, developed w/ "
110,2020-12-10 20:55:43,KW,Kuwait,949911600.0,15-Nov-2012 (15:14:27.000000),HidekoUNDP,,True,,768,,True,"  Today,  launches its new COVID-19 Data Futures Platform - a one-stop shop for evidence-based policy making towards 2030…"
112,2020-12-10 22:31:53,KW,Kuwait,7.928624467677307e+17,30-Oct-2016 (22:55:12.000000),over_dress,,False,,11,,True,  I've been getting a lot of questions of how the Pfizer's COVID19 vaccine side effect profile compares to other common vac…
113,2020-12-10 22:03:39,KW,Kuwait,7.928624467677307e+17,30-Oct-2016 (22:55:12.000000),over_dress,,False,,11,,True,"  NEWS:  published safety and final efficacy results from the Phase 3 trial of our #COVID19 vaccine, developed w/ "
115,2020-12-10 22:31:53,KW,Kuwait,7.928624467677307e+17,30-Oct-2016 (22:55:12.000000),over_dress,,False,,11,,True,  I've been getting a lot of questions of how the Pfizer's COVID19 vaccine side effect profile compares to other common vac…
118,2020-12-10 22:31:53,KW,Kuwait,7.928624467677307e+17,30-Oct-2016 (22:55:12.000000),over_dress,,False,,11,,True,  I've been getting a lot of questions of how the Pfizer's COVID19 vaccine side effect profile compares to other common vac…
123,2020-12-10 22:00:09,KW,Kuwait,183171024.0,26-Aug-2010 (09:36:03.000000),Dr_Mimz,,False,,3965,,True,"  2,977  The number of people killed on September 11, 2001.  3,011 The number of people killed by the coronavirus on December…"
127,2020-12-10 22:31:53,KW,Kuwait,7.928624467677307e+17,30-Oct-2016 (22:55:12.000000),over_dress,,False,,11,,True,  I've been getting a lot of questions of how the Pfizer's COVID19 vaccine side effect profile compares to other common vac…
128,2020-12-10 22:03:39,KW,Kuwait,7.928624467677307e+17,30-Oct-2016 (22:55:12.000000),over_dress,,False,,11,,True,"  NEWS:  published safety and final efficacy results from the Phase 3 trial of our #COVID19 vaccine, developed w/ "
131,2020-12-10 23:27:18,KW,Kuwait,1059647022.0,04-Jan-2013 (05:48:19.000000),Saoudalyaqout,,False,,362,,True,"  Federal advisers voted Thursday to recommend the FDA grant Pfizer COVID vaccine emergency use authorization, a milestone decisio…"
132,2020-12-11 00:55:06,KW,Kuwait,4874794643.0,03-Feb-2016 (20:31:14.000000),BipolarStar1,,False,,140,,True,  Saw this on TikTok &amp; thought I’d share - a simple explanation to the way the COVID-19 vaccine functions. 
133,2020-12-11 00:12:09,KW,Kuwait,232598561.0,31-Dec-2010 (16:44:04.000000),engmoh33,,False,,146,,True,  JUST IN: FDA advisers vote to recommend that the agency grant emergency use authorization to Pfizer and BioNTech's coronavirus va…
135,2020-12-11 05:50:41,KW,Kuwait,8.984627641167094e+17,18-Aug-2017 (08:33:10.000000),MauriceNKuwait,,False,,94,,True,"  Since March, various treatments for #COVID19 have been tested, some with very positive results.   Are politicians and pu…"
137,2020-12-11 05:50:12,KW,Kuwait,8.984627641167094e+17,18-Aug-2017 (08:33:10.000000),MauriceNKuwait,,False,,94,,True,  Coronavirus lockdowns have facilitated yet another massive wealth transfer from the poor &amp; middle class to the rich.  Yet…
138,2020-12-11 05:59:16,KW,Kuwait,1.0149313371433738e+18,05-Jul-2018 (17:57:42.000000),KasikYa,,False,,22475,,True,  #Blessingfriday #WearAMask  💖              
139,2020-12-11 03:40:14,KW,Kuwait,283532380.0,17-Apr-2011 (13:41:02.000000),Seham66,,False,,4336,,True,"  The first 30,000 doses of Pfizer's COVID-19 vaccine are set to arrive in Canada soon, allowing authorities to kick off a campa…"
140,2020-12-11 04:16:26,KW,Kuwait,257349536.0,25-Feb-2011 (06:43:22.000000),bosammy,,False,,9710,,True,  Heartwarming: Internet taxi driver in Iran calls the company support line and asks them to refund the passenger that he…
141,2020-12-11 03:35:03,KW,Kuwait,283532380.0,17-Apr-2011 (13:41:02.000000),Seham66,,False,,4336,,True,"  Hospitals, nurses and even UPS are readying for a potential rollout of Pfizer's COVID-19 vaccine, as the FDA is widely expecte…"
143,2020-12-11 03:35:03,KW,Kuwait,283532380.0,17-Apr-2011 (13:41:02.000000),Seham66,,False,,4336,,True,"  Hospitals, nurses and even UPS are readying for a potential rollout of Pfizer's COVID-19 vaccine, as the FDA is widely expecte…"
144,2020-12-11 03:35:39,KW,Kuwait,283532380.0,17-Apr-2011 (13:41:02.000000),Seham66,,False,,4336,,True,"  An FDA advisory panel voted in favor of Pfizer's COVID-19 vaccine, paving way for the agency to authorize the vaccine shot for…"
146,2020-12-11 03:40:14,KW,Kuwait,283532380.0,17-Apr-2011 (13:41:02.000000),Seham66,,False,,4336,,True,"  The first 30,000 doses of Pfizer's COVID-19 vaccine are set to arrive in Canada soon, allowing authorities to kick off a campa…"
147,2020-12-11 03:35:03,KW,Kuwait,283532380.0,17-Apr-2011 (13:41:02.000000),Seham66,,False,,4336,,True,"  Hospitals, nurses and even UPS are readying for a potential rollout of Pfizer's COVID-19 vaccine, as the FDA is widely expecte…"
148,2020-12-11 03:35:39,KW,Kuwait,283532380.0,17-Apr-2011 (13:41:02.000000),Seham66,,False,,4336,,True,"  An FDA advisory panel voted in favor of Pfizer's COVID-19 vaccine, paving way for the agency to authorize the vaccine shot for…"
150,2020-12-11 03:40:14,KW,Kuwait,283532380.0,17-Apr-2011 (13:41:02.000000),Seham66,,False,,4336,,True,"  The first 30,000 doses of Pfizer's COVID-19 vaccine are set to arrive in Canada soon, allowing authorities to kick off a campa…"
151,2020-12-11 03:35:03,KW,Kuwait,283532380.0,17-Apr-2011 (13:41:02.000000),Seham66,,False,,4336,,True,"  Hospitals, nurses and even UPS are readying for a potential rollout of Pfizer's COVID-19 vaccine, as the FDA is widely expecte…"
152,2020-12-11 03:35:39,KW,Kuwait,283532380.0,17-Apr-2011 (13:41:02.000000),Seham66,,False,,4336,,True,"  An FDA advisory panel voted in favor of Pfizer's COVID-19 vaccine, paving way for the agency to authorize the vaccine shot for…"
154,2020-12-11 03:40:14,KW,Kuwait,283532380.0,17-Apr-2011 (13:41:02.000000),Seham66,,False,,4336,,True,"  The first 30,000 doses of Pfizer's COVID-19 vaccine are set to arrive in Canada soon, allowing authorities to kick off a campa…"
155,2020-12-11 03:35:03,KW,Kuwait,283532380.0,17-Apr-2011 (13:41:02.000000),Seham66,,False,,4336,,True,"  Hospitals, nurses and even UPS are readying for a potential rollout of Pfizer's COVID-19 vaccine, as the FDA is widely expecte…"
156,2020-12-11 05:48:21,KW,Kuwait,8.984627641167094e+17,18-Aug-2017 (08:33:10.000000),MauriceNKuwait,,False,,94,,True,  The real reason for ending the daily feast mongering! Approval rate for COVID-19 handling plummets in Ontario amid second…
157,2020-12-11 05:50:12,KW,Kuwait,8.984627641167094e+17,18-Aug-2017 (08:33:10.000000),MauriceNKuwait,,False,,94,,True,  Coronavirus lockdowns have facilitated yet another massive wealth transfer from the poor &amp; middle class to the rich.  Yet…
158,2020-12-11 04:05:31,KW,Kuwait,8.474171812561388e+17,30-Mar-2017 (11:56:15.000000),KhaireBipin,,False,,160,,True,  Bumper crop. No buyers. No export. Story of Watermelon growers in Karnataka. 2020 is a terrible year for all. #COVID19 
159,2020-12-11 05:50:41,KW,Kuwait,8.984627641167094e+17,18-Aug-2017 (08:33:10.000000),MauriceNKuwait,,False,,94,,True,"  Since March, various treatments for #COVID19 have been tested, some with very positive results.   Are politicians and pu…"
160,2020-12-11 05:48:21,KW,Kuwait,8.984627641167094e+17,18-Aug-2017 (08:33:10.000000),MauriceNKuwait,,False,,94,,True,  The real reason for ending the daily feast mongering! Approval rate for COVID-19 handling plummets in Ontario amid second…
161,2020-12-11 05:50:12,KW,Kuwait,8.984627641167094e+17,18-Aug-2017 (08:33:10.000000),MauriceNKuwait,,False,,94,,True,  Coronavirus lockdowns have facilitated yet another massive wealth transfer from the poor &amp; middle class to the rich.  Yet…
162,2020-12-11 05:50:41,KW,Kuwait,8.984627641167094e+17,18-Aug-2017 (08:33:10.000000),MauriceNKuwait,,False,,94,,True,"  Since March, various treatments for #COVID19 have been tested, some with very positive results.   Are politicians and pu…"
164,2020-12-11 03:40:14,KW,Kuwait,283532380.0,17-Apr-2011 (13:41:02.000000),Seham66,,False,,4336,,True,"  The first 30,000 doses of Pfizer's COVID-19 vaccine are set to arrive in Canada soon, allowing authorities to kick off a campa…"
165,2020-12-11 05:48:21,KW,Kuwait,8.984627641167094e+17,18-Aug-2017 (08:33:10.000000),MauriceNKuwait,,False,,94,,True,  The real reason for ending the daily feast mongering! Approval rate for COVID-19 handling plummets in Ontario amid second…
166,2020-12-11 03:35:39,KW,Kuwait,283532380.0,17-Apr-2011 (13:41:02.000000),Seham66,,False,,4336,,True,"  An FDA advisory panel voted in favor of Pfizer's COVID-19 vaccine, paving way for the agency to authorize the vaccine shot for…"
167,2020-12-11 03:35:39,KW,Kuwait,283532380.0,17-Apr-2011 (13:41:02.000000),Seham66,,False,,4336,,True,"  An FDA advisory panel voted in favor of Pfizer's COVID-19 vaccine, paving way for the agency to authorize the vaccine shot for…"
168,2020-12-11 05:38:01,KW,Kuwait,9.337769296180593e+17,23-Nov-2017 (19:19:03.000000),MohdAshraf8016,,False,,876,,True,"  Puducherry reported 43 new #COVID19 cases, 48 discharges &amp; 2 deaths today.  Total positive cases in the Union Territory rise to 37…"
169,2020-12-11 05:39:48,KW,Kuwait,39064708.0,10-May-2009 (15:47:32.000000),basheed,,False,,384,,False,"#Mandir for Upper Caste,  #Beeflaw for SC, #COVID19 jobless for rest of the poors, #TooMuchOfDemocracy"
170,2020-12-11 05:16:34,KW,Kuwait,16684925.0,10-Oct-2008 (16:03:32.000000),krutherford,,False,,29,,True,"  Do you have questions about the COVID-19 vaccines? Who should get vaccinated, and how safe are the vaccines? To help answe…"
178,2020-12-11 09:17:00,KW,Kuwait,7.855999190170583e+17,10-Oct-2016 (21:56:31.000000),DrMhmdotaibiq8,,False,,110,,True,  France will have a 8 PM curfew starting 15 December   Curfew will include New Years Eve   #BreakingNews   #CoronaVirusUpda…
182,2020-12-11 07:00:57,KW,Kuwait,9.337769296180593e+17,23-Nov-2017 (19:19:03.000000),MohdAshraf8016,,False,,877,,True,"  Odisha recorded 387 new #COVID19 cases, 458 recoveries and 4 deaths yesterday, as per State Health Department   Total cases: 3,23,…"
190,2020-12-11 09:03:33,KW,Kuwait,303366784.0,22-May-2011 (19:01:17.000000),shaydaymutairay,,False,,1218,,True,  I've been getting a lot of questions of how the Pfizer's COVID19 vaccine side effect profile compares to other common vac…
191,2020-12-11 09:03:33,KW,Kuwait,303366784.0,22-May-2011 (19:01:17.000000),shaydaymutairay,,False,,1218,,True,  I've been getting a lot of questions of how the Pfizer's COVID19 vaccine side effect profile compares to other common vac…
195,2020-12-11 12:27:49,KW,Kuwait,1.2135290167595418e+18,04-Jan-2020 (18:34:16.000000),BlackwidowKw,,False,,209,,False,FDA advisory panel recommends approval of Pfizer Covid vaccine for emergency use 
198,2020-12-11 12:18:33,KW,Kuwait,33146552.0,19-Apr-2009 (06:09:38.000000),kholood862,,False,,1661,,True,  Honour another of our fallen heroes.
201,2020-12-11 13:07:49,KW,Kuwait,1.2231863339941233e+18,31-Jan-2020 (10:09:00.000000),sohail_parkar,,False,,15,,True,"  20,000 crore  Gov spending on  project to build new parliament house,This money could have been well spent on healing &amp; re…"
207,2020-12-11 11:42:07,KW,Kuwait,1.3319121470105477e+18,26-Nov-2020 (10:46:29.000000),Pleiadian_Dust,,False,,76,,False,They were oblivious as they have been for the Flu years now but even if the goverments decide to control the flu narrative same obedience will ensue 🙄
